0,1,enable remove language code dev center language history example select ru ru ru laguage publish xap store cause tile localization en us(default tile localization bad
1,0,note .csproj file supportedcultures entry like supportedcultures de de;ru;ru ru /supportedcultures remove ru language code publish new xap version old xap version remain store replaced unpublished
2,0,wich mean new version fully replace old version cause problem 1
3,0,user receive old xap version app
4,0,store randomly old xap new xap version app
5,0,app wp7 version wp8 version xap submission
6,0,wp7 xap work wp7 wp8 xap work wp8
7,0,store wrong wp7 xap version app windows phone 8 user
8,1,option remove ru language code app language history option completly replace fully replace prevoius(es xap(s
9,0,currently mistakenly select ru language bad situation forever live wrong tile display russian language store english publish update remove ru language update fully replace old version truble 1
10,0,): store randomly deliver old wrong version xap
11,0,write lot support ticket care issue
12,0,engineering team solve issue follow 1
13,1,provide workaround remove ru language language history need ru culture ru ru way remove ru language history post app ru language support 2
14,1,add implement appreslib.dll.xxxx.mui ru language culture documentation appreslib.dll.xxxx.mui exist ru ru ru culture http://msdn.microsoft.com/en-us/library/windowsphone/develop/ff967550(v=vs.105).aspx thank tom enable remove language code dev center language history example select ru ru ru laguage publish xap store cause tile localization en us(default tile localization bad
15,0,wich mean new version fully replace old version cause
16,0,drive car need 99 time phone use vocal command start bing search instead contact
17,0,press power button unlock device open phone person device start correctly
18,0,drive mode activate
19,0,italian translation read sm device fatto end operation work ho finito
20,0,fatto vocal command unrecognized
21,0,little bug lumia 820 wp8 upgrade work fine vocal command upgrade bad
22,0,recognize command
23,0,old wp7 work fine use bt sony car stereo
24,0,little bug lumia 820 wp8 upgrade work fine vocal command
25,0,outlook color scheme
26,0,setting current live tile size
27,0,open network setting tap setting
28,0,hit power button sleep mode
29,0,wait 15 20 minute switch mobile
30,0,window blank head
31,0,100 reproducible lumia 920 cyan update
32,1,use feature fix asap
33,0,issue sd card wp 8.1 preview
34,1,annoying fix
35,0,work lob field engineering civil structural
36,0,point app universal device engineer spend time learn relearn control
37,0,app run tablet pc 's engineer work field come office continue work datum pc 's
38,0,window 8.1 window phone 8.1 universal app hop adapt app window phone
39,0,save live datum save onedrive allow roam device
40,0,find window phone 8.1 file picker access onedrive futureaccesslist
41,0,aspect prevent adaptation app window phone platform
42,1,allow window phone 8.1 file folder picker access onedrive store location futureaccesslist
43,1,allow onedrive folder store locally like winrt
44,0,real universal app
45,0,save live datum
46,0,far try different app access pre window phone 8.1 photo
47,1,need fix number 1 priority
48,1,nice developer option payment hold reach appropriate threshold option payment reach threshold
49,0,wp8.1 dev preview bug push service
50,0,i__m mobile datum connection notification i__m wifi connection push server
51,0,find workaround turn mobile datum connection manually push wifi work
52,0,wp 8.0 gdr 3 system recognize automaticly wich connection i__m use turn push service automaticly cellular wifi
53,0,everytime work wp 8.1 dev preview doesn__t
54,0,try insert new bank account receive error validation bank account country account
55,0,think correct use paypal receive money country want pay extra cost paypal insert tax plan country different country account
56,1,remove validation validate accord tax plan country account
57,0,post vote change country account
58,0,post vote
59,0,report app purchase today notice line item app version 1.0.0 certainly case
60,0,bing vision lens camera app pinnable start quick access and/or add cortana screen left music search button
61,0,windows phone 8 able directly access facebook people hub
62,0,comment photo write wall enter facebook app
63,0,able switch text message facebook message fly
64,0,windows phone 8.1 app open
65,0,lumia 920 significantly long
66,0,slow
67,1,bring simplicity efficiency windows phone
68,1,build web application notice single page application url http://www.contoso.com/!#/ display blank page refresh load page check
69,1,great add remoteid calendar
70,0,appointment remoteid calendar
71,0,easy sync calendar remoteid like appointment
72,0,application unpublish microsoft reason send email
73,0,email receive like case developer know reason
74,0,easily fix write dev center
75,0,winrt tilebrush class miss tilemode view property present framework like wpf silverlight
76,1,add property support image tiling properly
77,0,ton request past year
78,0,thread example http://social.msdn.microsoft.com/forums/windowsapps/en-us/bb5aa859-e3d1-46f2-a661-d4bdbee9a1f2/windowsuixamlmediaimagebrush?forum=winappswithcsharp
79,1,lockscreen text attribute separate tile attribute
80,0,provide lockscreen text necessary use widebackcontent attribute flip tile
81,0,generate custom tile and/or want tile flip use lockscreen text feature
82,0,try use api contacts namespace windows applicationmodel contact work expect
83,0,windows phone 8.1 ioexception try pickcontactasync
84,0,strange expect contacts app launch problem establish contract
85,0,check contacts permission enable package.appxmanifest
86,0,windows 8.1 rt 8.1 che pickcontactasync work receive wrong datum instaed example firstname lastname firstname lastname importantdates e.g.
87,0,birthday set low value like 05/05/0004 try navigate contact outlook.com contacts people app right value
88,0,maybe miss api break
89,0,windows 8.1 rt 8.1 che pickcontactasync work receive wrong datum instaed example firstname lastname firstname lastname
90,0,possible define custom etw event generate event publicly available tooling currently provide way access event
91,0,windows phone developer power tools enable collection predefin profile use certain system event
92,0,appear way tell collect datum custom event source
93,0,e.g. .net base store app system diagnostic trace eventsource class available use generate custom etw event appear point moment actually record event trace
94,0,clear duplicate http://wpdev.uservoice.com/forums/110705-dev-platform/suggestions/3743880-please-provide-etw-logging-from-a-windows-phone-8 reply thread point log etw event wp8 app
95,1,want ability record alongside system provide etw event code 's activity fit system behaviour
96,0,e.g. .net base store app system diagnostic trace eventsource class available use generate custom etw event appear point moment
97,1,old onedrive integration window phone 8.1
98,0,use sync fast able view picture photo album easily
99,0,app long time load
100,0,happen facebook integration
101,0,use good 7.8
102,0,minimize maximize picture maximize
103,0,purchase window phone smooth integration slowly app os integration
104,0,microsoft provide system event smsreceiv app notify sms receive need event phone phonereveived ...
105,1,good read api phone history developer help good phone related app like android
106,0,mapicon window phone sdk 8.1 able use zindex event tap accessible mapicon
107,1,allow messaging application join default messaging application hub message interaction
108,0,-application use api hub message send view delete etc ... sms -the message hub use api application thing send view delete etc ... message
109,0,mean developper ablity implement application api message hub use
110,1,need windows phone synchronize clock internet
111,0,country work provider service
112,1,include api add remove deactivate tracking protection list tpl drive datum usage enable selective protection rogue site tracking sense control
113,0,like desktop ie
114,1,provide help understand text come cortanan
115,0,thing think like understand date time
116,0,plan new agenda item example nicely
117,0,pivot panorama control option enable disable wrapping
118,0,scroll viewer option disable overscrolling effect
119,0,"program work windowsphone 8.1 livesdk 5.6 bool connect false try var authclient new liveauthclient liveloginresult result await authclient loginasync(new string wl.signin wl.skydrive result status liveconnectsessionstatus connected connected true var connectclient new liveconnectclient(result session var meresult await connectclient getasync(""me dynamic medata meresult result catch liveauthexception ex // display error message"
120,0,catch liveconnectexception ex // display error message
121,0,catch generic exception obtain exception message object reference set istance object row liveloginresult result await authclient loginasync(new string wl.signin wl.skydrive authclient null
122,0,write msdn forum receive reply ...
123,0,catch generic exception obtain exception message object reference set istance object row liveloginresult result
124,0,use recover file
125,0,hoello wp8.1 silverlight xap app force use fast resume
126,0,break app swipe tunes hastilly submit wp8.1 update transparent tile realise later fast resume cause issue secondary tile etc
127,0,fast resume pretty kill app delete wp8.1 xap store look like app able wp store new abandon previous customer
128,1,option wpappmanif file untick fast resume allow wp8.1 app run fast resume mode like wp8
129,0,http://windowsphone.uservoice.com/forums/101801-feature-suggestions/suggestions/6080912-we-want-open-the-app-by-tap-the-quick-status-icon
130,1,allow nfc capable windows phones pay wallet app use nfc location card reader support
131,0,google wallet able 3 year
132,0,youtube use google wallet mcd.
133,0,support destroy argument apple device time soon close gap functionality wp android
134,1,developer need create edit document windows store apps
135,0,integrate winrt app office
136,0,openxml sdk office winrt office primary interop assembly class winrt win8 application need productive business
137,0,microsoft pubcenter claim interstitial
138,0,big ad format interstitial know ad network
139,0,interstitial display break point app game
140,0,app game developer important good fill rate
141,0,allow prefetch ad allow developer optimise ad strategy
142,0,able house ad pubcenter fill ad request
143,1,provide access cpu gpu datum c
144,0,style page font style italic font segoe ui render bold style rest page
145,0,http://social.msdn.microsoft.com/forums/windowsapps/en-us/2c0cbd51-ae37-4ab7-a3e4-7e1d7cce8643/segoe-ui-italic-looks-bold?forum=winappswithhtml5 screenshot possible bug
146,0,suggestion close need mark complete
147,0,know support current device read nfc card tag low level
148,0,deceptive device nfc capability reality read specific type tag
149,0,product need support nfc card read write exist device type card mifare ul ulc calypso desfire maybe read wp8.1 functionality add device specific nfc chipset currently present device
150,1,provide low level reading write functionality nfc device field
151,0,product need support nfc card read write exist device type card mifare ul ulc calypso desfire maybe read wp8.1 functionality
152,0,supremely annoying develop certification wait time add app purchase product dev center
153,0,sure think reason certification need merely price key type
154,1,remove cert process allow add instantly
155,0,port windows 8 app windows phone 8 feel universal app template awesome thing increase productivity 1 create pages usercontrol folder let face want create sh app ui platform end create page control version
156,0,vs2013 create folder project bring class page user control original project
157,0,state folder use pages usercontrols rule deal
158,0,2 use settingsflyouts time replicate page windows phone project
159,1,automatic
160,0,3 likewise app bar windows 8 translate windows phone version automatically example button find control
161,0,4 styles.xaml whatev file contain templates styles 1
162,0,believe kind automatic measure remember 4 port simple app
163,1,recognize threshold arrive code matching windows windows phone achieve 100 matter anymore time nice addition
164,0,state folder use page
165,0,wish pubcenter way merge app platform windows windows phone obviously include universal apps
166,0,use headphone music pause cortanta notify incoming text message
167,0,music continue play respond notification
168,0,podacast pause continue play inaudibly background interact cortanta
169,1,bug fix medium play pause interact cortanta
170,1,trial feature build automatic enforcement user prompt disabling etc windows store
171,0,windows store choose trial mode app pick number day want trial
172,0,care
173,0,user uninstall trial track fact prevent start new trial later
174,0,contrast windows phone world developer indicate trial mode store manually track number day install user purchase etc
175,0,user uninstall install later developer idea
176,0,add trial mode windows phone feel like implement pray
177,0,absolutely love windows store implementation
178,1,store combine bring build trial mode support windows phone
179,0,contrast windows phone world developer indicate trial mode store manually track number day
180,1,able start app like flashlight app directly notification center
181,1,add recent place suggestedstartlocation fileopenpicker api
182,0,time hard navigate time location
183,1,provide access calendar api customize day style base requirement
184,0,frustrating windows windows phone developer hint send certification fail report easy tackle obvious issue arise restriction windows/ windows phone
185,0,hard find solution hear right pointer keyword efficiently nearly effortlessly
186,0,example obvious issue easy solution know problem app fail certification dark light theme problem
187,0,set background fix color black code light theme font color set white black windows phone automatically text readable
188,0,problem occur multiple code place case
189,0,"add follow line report probably send thousand time save hour search efficient solution reading ---------------------- help dark light theme problem visibility)application current resources[""phonedarkthemevisibility similar brush)application current resources[""phonebackgroundbrush ---------------------- maybe additional link documentation frustrating windows windows phone developer hint send certification fail report easy tackle obvious issue arise restriction windows/ windows phone"
190,0,set background fix color black
191,0,close
192,0,implement auto upload feature silverlight 8.1 application cause application clickable auto upload setting menu phone setting
193,0,information http://social.msdn.microsoft.com/forums/windowsapps/en-us/2ebba203-dae1-409e-940e-14e33b422a21/auto-upload-app-not-launching-in-settings-page?forum=wpdevelop
194,1,release lock screen api developer treat devs equally
195,0,create app use mediastreamsource stream audio windows phone 8.0 work great
196,0,"port app windows phone 8.1 sound flicker component stack overflow ""- e"
197,0,discussion msdn forum http://social.msdn.microsoft.com/forums/wpapps/en-us/37ac0ed7-1884-4251-9914-07fae6467b98/mediastreamsource-not-working-properly-in-windows-phone-81?forum=wpdevelop sample project source code https://wp8libflac.codeplex.com/
198,0,publish app windows phone store windows app store
199,1,want bundle app
200,0,unfortunately able set price marketplace way
201,0,windows app store choose price tier
202,0,country price automatically set
203,0,windows phone store able set price county separately
204,1,need windows app store 1
205,0,exchange rate us$ low
206,0,rate set 1 1
207,0,calculate price change price country manually lot country change
208,0,willing charge canada europe 2
209,0,change exchange rate argentina indonesia south africa
210,0,rate low set value manually 3
211,0,checkbox add additional fee 13.9 normal store fee percentage net receipts deduct calculate application proceeds market argentina chile colombia costa rica malaysia mexico peru south africa
212,0,fee apply alternative payment method e.g.
213,0,carrier billing credit card transaction windows phone store publish app windows phone store windows app store
214,0,calculate price
215,0,currently possible change package identity app publish bit frustrating
216,0,user like wait click app
217,0,splash screen app consumer wait actual screen load
218,0,impression app slow
219,1,think microsoft need consider splash screen
220,1,user click app directly ui lag
221,0,let normal http:// uri able send notification app use window.external.notify https:// uri
222,0,power developer decide page allow use scriptnotify event
223,1,extend mediaelement support youtube video simple
224,0,probably collaborate google challenge
225,0,unleash developer power store win
226,0,"bug easy reproduce var wbmp new writeablebitmap(480,640 await wbmp setsourceasync(stream //the stream come picture large size i.e."
227,0,960x1280 check property wbmp pixelwidth 960 pixelheight 1280 pixelbuffer length 1228800 length pixelbuffer totally wrong buffer size shoud 960 x 1280 x 4 4915200 wrong value 1228800 come original size 480 x 640 x 4
228,1,think bug think writeablebitmap decide update pixelwidth pixelheight property update pixelbuffer data inconsistent
229,0,era connected tv
230,1,windows developer need api control tv tuner display digital medium screen time
231,1,multitask real thing like video mini calc browse thing
232,1,limit number app accord screen size
233,1,provide api use cortana service app provide implementable interface(s expose app services cortana cortana method developer worldwide extend functionality
234,1,add api 's share reading list
235,0,useful feature
236,1,useful share reading list chrome extension mac desktop ios
237,0,listview grouped item
238,0,"listview grid row=""1 selectionmode=""none isitemclickenabled=""false itemssource=""{bind source={staticresource csvlist listview groupstyle groupstyle groupstyle headertemplate datatemplate grid border borderthickness=""2 borderbrush=""blue textblock text=""{binding key margin=""5,0,0,0 style=""{staticresource subheadertextblockstyle foreground=""white /border /grid /datatemplate /groupstyle headertemplate /groupstyle /listview groupstyle listview itemtemplate datatemplate ... /datatemplate /listview itemtemplate listview itemcontainerstyle style targettype=""listviewitem setter property=""horizontalcontentalignment value=""stretch /style /listview itemcontainerstyle /listview use xaml definition work groupheader wide listview"
239,0,"reason insert width=""{bind actualwidth elementname hubevidenza mode oneway --hubevidenza root container hubsection -- content groupstyle headertemplate"
240,0,work ... header group display
241,0,problem windows 8.1 windowsphone 8.1 listview grouped item
242,0,work ... header
243,1,provide way list instal application phone
244,0,acutally respect users regional format setting
245,0,start window phone 8.1 emulator follow configuration testing purpose ui language german region format setting irish
246,0,find way information user set format setting irish
247,1,wish format datetime like user want
248,0,regional format automaticly mean region set device ui langauge choose
249,0,devices set ui english want timestamps dates german format ...
250,0,moment way set user phone setting
251,0,devices set ui english want
252,0,app windows phone able run lock screen time
253,0,new universal app model provide functionality
254,1,add future version important feature app
255,0,windows phone 8.1 introduce social extensibility framework
256,0,allow party app integrate people hub 's new feed etc
257,0,currently integration lock select app developer access
258,0,documentation windows phone socialintegration namespace limit
259,1,like microsoft open framework developer
260,0,understand framework develop real word usage measure
261,1,allow use locally sideload emulator
262,0,think provide valuable feedback come exciting scenario 's use framework
263,0,think provide valuable feedback come exciting scenario 's
264,0,create export project win8.1 app instruction provide site try install app win8
265,0,cert
266,0,instal successfully
267,0,try install app error
268,0,storeapp\appstudio windows_1.0.0.0_anycpu.appx
269,0,allow bind isvisible mvvm scenario
270,0,possibly property parent choose popup reveal
271,0,suitable mvvm
272,1,like record audio video file play audio file background
273,0,reason figure company microsoft find
274,0,killer app wait window catch
275,0,know set speaker microphone way separate left speaker right lot devs happy able
276,0,convenient swipe gesture fun tap method
277,1,swipe gesture tap method
278,0,set difference swipe right launch setting menu swipe left launch app list
279,0,currently develop app post photo user 's picasa account
280,0,user request app provide functionality edit photo account upload new version
281,0,think good resource implement functionality great photo editing app market
282,1,like ability pass photo app app user 's choice app picker support select photo type
283,0,user function select app e.g.
284,1,add filter crop etc open app pass edit file app
285,0,extend power available share picker perform generic task result good experience user
286,0,sandbox mentality os
287,0,available winrt silverlight application
288,0,user function select app
289,1,thing increbible phone sound whistle clap hand certain pattern wich preset phone owner find phone buddy text find
290,1,lockscreen -should able chose tiny black outline letter write properly clear white lock screen
291,1,-should able transparent save pgn lockscreen like wp7.5 notification center -should able control screen notification center half open
292,1,-should able control music play pause previous song info directly notification center
293,1,xbox music -should able swap music player sideways
294,1,picture -need open albums instead picture mail center -would awesome open page seperate account
295,0,choose open
296,1,-should able transparent save pgn lockscreen like wp7.5 notification center -should able control screen
297,1,report include price final payment
298,0,company need correct sale estimate account purpose
299,0,windows 8.1 sdk bring lot build transition easy develop native like app
300,0,miss list animation settings messaging app open close
301,0,property like isstaggeringenabled isstaggerelement commonnavigationinfo class animation feel like native
302,0,thank good work windows phone
303,1,necessary condition developer choose proper represent application high quality image application symbol store matching modern ui app simply ugly icon pixelat android like pirate mislead ..
304,0,time app game free limited time offer promotion
305,0,user miss need category app free price change limited time offer like red stripe deal
306,0,ie wp8.1 update error load page body tag contain onload window.location function i.e.
307,0,"onload=""window.location='#april"
308,0,try backup restore yesterday
309,0,wp8.1 backup restore app
310,0,nokia 's app example nokia camera maps drive+
311,0,need install manually
312,0,nokia app instal default buy phone photo video relate app restore
313,0,restore phone maps drive+ tile
314,0,sign app exist store
315,0,course exist store
316,0,instal manually later
317,0,contact different default ringtone
318,0,restore
319,0,contact ringtone
320,0,glance screen setting night mode restore
321,0,course exist store
322,0,recently use api private client certificate
323,0,surprised read msdn return result async
324,0,think return import pfx
325,0,"scenario clearly api change help improve code flow var clientcert ensurecertficatesasync function logger.trace(""check client certificate clientcert logger.info(""us load client certificate return winjs.promise.as(clientcert var certquery new certificates certificatequery certquery.friendlyname client cert return certificates certificatestores.findallasync(certquery).then(function(cert certs.length return windows storage storagefile.getfilefromapplicationuriasync(""ms appx:///cert client.pfx .then(windows storage fileio.readbufferasync).then(function(buffer var pfx windows security cryptography cryptographicbuffer.encodetobase64string(buffer logger.info(""install client certificate return certificates certificateenrollmentmanager.importpfxdataasync pfx xxxxx certificates exportoption.notexportable certificates keyprotectionlevel.noconsent certificates installoptions.none certquery.friendlyname .then(function // search store omit logger.info(""client certificate instal return certificates certificatestores.findallasync(certquery .then(function(certs return clientcert certs[0 logger.info(""client certificate instal return clientcert certs[0 instal pfx query store fetch pfx use httpclient filter"
326,0,break change
327,0,current user expect return success continuation check return value
328,0,thank consideration
329,0,"scenario clearly api change help improve code flow var clientcert ensurecertficatesasync function logger.trace(""check client certificate clientcert logger.info(""us load client certificate return winjs.promise.as(clientcert var certquery new certificates certificatequery certquery.friendlyname client cert return certificates certificatestores.findallasync(certquery).then(function(cert certs.length return"
330,0,lot
331,0,wifis display usable ... android device work fine
332,1,arabic keyboard find lumia 610 support arabic
