6073,0,event registration order difference
6074,0,problem thing like
6075,0,cached splitview ispaneopen true inside frame navigate forward
6076,0,splitview capture backrequested page navigation
6077,0,developer try discord app windows phone windows tablet xbox hololens
6078,0,horizontal scrolling available row
6079,0,user press button item item scroll set item appear screen
6080,0,example good example youtube homepage control suggest video different channel single row
6081,0,user press button item item scroll set item appear the 
6082,0,find possible way assume exist currently
6083,0,serialdevice implementation appear unstable general doubly compile native
6084,0,follow reliably throw flavor interop exception
6085,0,possible set calenderidentifier property tell control calender use
6086,0,possible set hijri adjustment month ramadan shaban vary region user user like use adjustment different country
6087,0,windows 10 calender app case feature calender set alternative calender hijri new setting hijri adjustment work nice
6088,0,know achieve know api uwp right
6089,0,datetime control datepicker calenderview etc
6090,0,know achieve know api uwp it 
6091,0,use uk keyboard layout key work
6092,0,applicationview suppresssystemoverlay deprecate warning message use tryenterfullscreenmode instead
6093,0,important difference behavior prevent switch
6094,0,use screen mode statusbar showasync work
6095,0,context matter app video stream app vod live tv content
6096,0,user start video playback phone use suppresssystemoverlay hide navigation bar device lumia 950 status bar
6097,0,turn status bar visible playback control user tap screen
6098,0,information status bar highly relevant video app
6099,0,sure replace status bar ui contain info
6100,0,user start video playback phone use suppresssystemoverlay hide navigation bar device lumia 950 them) 
6101,0,possible submit edge extensions store
6102,0,think year
6103,0,currently win2d directionalblureffect mark nocomposition use composition api creator 's update new insider build fall creator 's update
6104,0,dotnet framework uncompress open application user interface
6105,0,client rest api 's return json datum maintain session server
6106,0,new model develpement use window web applciation
6107,0,differnce window application web aplication url point local gonnabe window standalone app els web app
6108,0,shoudl configurable
6109,0,soon market ease development boom eventually kill browser like chrome angular concept microsoft opportunity beat
6110,0,label developer .net developer instead window developer web application developer
6111,0,use uwp app bitmapicon urisource blank happen use databind app crash navigate page contain webview
6112,0,test windows 10 creators update vs2017 15.2
6113,0,100 repro available zip
6114,0,let imagine draw rectangle yellow rounded corner add follow text login right group want button simply click convert button click toggle xaml click xaml code copy clipboard paste code xamarin form visual studio
6115,0,life easy million developer
6116,0,work motion blur effect post process store velocity render target
6117,0,stuck use dxgi_format_r8g8b8a8_snorm
6118,0,timepicker timepickerflyout support hour minute period pm selection
6119,0,second selection useful need
6120,0,contenttemplateselector break bind viewmodels
6121,0,significant bug kind hard believe fix ...
6122,0,following link appear refer bug
6123,0,seven month issue address
6124,0,error type vm.data object
6125,0,represent control contain audio video
6126,0,natively support transition effect medium
6127,0,support natively play playlist input ie collection uri
6128,0,infinite loop reproduction
6129,0,video overlay support example picture picture
6130,0,native support svg animation smil inside xaml beautiful responsive ui hardware acceleration backend opengl direct3d vulkan metal
6131,0,advantage xaml natively support svg smil developer worry icon animation design animator software deliver svg
6132,0,addition able search internet svg animate icon ready use
6133,0,widely use real world today
6134,0,area find type control audio video playe visual programming animation software single multitrack audio editor video editor slide editor photo gallery website social network
6135,0,backgroundtasks currently launch 15 minute timetrigger
6136,0,unfortunately task launch timetrigger appear idle operating system suspended
6137,0,mean task execute 15 minute window
6138,0,current backgroundtask timer allow background task wake timer event periodically processing wait
6139,0,low processing look idle suspend
6140,0,leave idle task idle use system resource right
6141,0,like way mspoweruser app implement feature
6142,0,app click continue read button device connect device
6143,0,click device open app device artice
6144,0,street streetnumber property maplocationfinder findlocationsasync result value
6145,0,street house number include correctly formattedaddress property
6146,0,bug occur sine creators update
6147,0,sense force compile c#/.net target prior uploading package windows store
6148,0,microsoft add arm64 target tomorrow
6149,0,handle render entire interface command use directx rendering
6150,0,work briliantly line code
6151,0,mean real simple api uwp want simple api
6152,0,thing compare drag drop
6153,0,follow link sound awfully complicated honestly know start
6154,0,example drag drop c:\folder\image.bmp file app window app generate c:\folder\image.png need simple api like void onfilesdropped(str file_name int window_client_pos_x int window_client_pos_y .. file_name array path file folder drag drop app 2 parameter xy coordinate client window position drag drop occur
6155,0,want use file picker xaml
6156,0,handle render entire interface my 
6157,0,mark r. win ... tegration
6158,0,like
6159,0,app service real time bi direction
6160,0,test surprise dxgi_swap_effect_flip_discard instead bring performance improvement slow thing
6161,0,nvidia geforce 650 gt late video driver april 2017
6162,0,windows 10 late update 2017
6163,0,simple application clear backbuffer time present screen
6164,0,v sync mode clear time 60 fps limit
6165,0,limit uwp directx12 flip mode slow
6166,0,bc7 great bc1 quality good need small size texture game currently 11 gb texture datum
6167,0,happen astc texture format
6168,0,originally suppose include directx later scrap
6169,0,eventually
6170,0,currently use 2 texture format
6171,0,relocate user folder old download folder remain add old storagefolder storageapplicationpermission futureaccesslist
6172,0,currently painful add new controls new windows sdk version app support old version
6173,0,way potentially fix
6174,0,helpful come upcoming fluent design support new fluent design styles support design waves
6175,0,like xamarin form instead of 
6176,0,especially interested work app span different hardware type regardless form factor os -- idea seamless experience windows desktop android ios mobile compelling ... need example invest
6177,0,read project rome possibility create cross device experience https://blogs.windows.com/buildingapps/2016/10/11/cross-device-experience-with-project-rome/ particularly interested project rome android sdk https://blogs.windows.com/buildingapps/2017/02/08/announcing-project-rome-android-sdk/#hql7ibqtugyzrufw.97
6178,0,extremely slow
6179,0,b draw mappolygon blur jagged border
6180,0,c draw mappolyline wrong position
6181,0,right position manual shifting map initially 20 30 misplace add mapelements collection
6182,0,occur near map border
6183,0,sdk support installation try new api uwp apps
6184,0,way distribute kind app tester customer use win10 insider preview
6185,0,allow customer update sdk level
6186,0,know microsoft apps update new sdk available store insider preview
6187,0,example ms provide lot sdk new technology win10 fall cu
6188,0,app target business wish support old device late version
6189,0,uwp media element mediaplayerelement fantastic ui.but codec play different kind audio video file limited
6190,0,thankyou
6191,0,ensure registration complete com server add regsvr32 command post build set linker value register output false
6192,0,error class_not_registered message
6193,0,issue client app packagedcomserver sample 2 setting change
6194,0,link sample https://github.com/microsoft/desktopbridgetouwp-samples/tree/master/samples/packagedcomserver
6195,0,create attach property assume false set default like check the 
6196,0,microsoft ime justsystems atok work fine
6197,0,course win32 apps uwp apps use goggle ime
6198,0,scan entire computer certification way outside scope build uwp application
6199,0,hour steam library
6200,0,cortana windows iot core support english
6201,0,ability provide powerful animation markup
6202,0,especially stringformatconverter formatstingconverter
6203,0,find easy way download payout summary automate fashion
6204,0,probably look correct place
6205,0,far chat rep indicate currently support
6206,0,insane
6207,0,report sale information source
6208,0,webproxy property impact windows 10 system
6209,0,try launchuriasync launchfileasync tablet mode app app load background
6210,0,start menu tile
6211,0,fledged docking mdi control like
6212,0,appear mapicon render mapcontrol change significantly windows 10 creator update
6213,0,app time add mapicon object mapcontrol
6214,0,creator update work fine vast majority display
6215,0,creator update small portion mapicon object render map
6216,0,collide mapicons
6217,0,large portion map display mapicons add
6218,0,aware guidance mapicon guarantee display problem
6219,0,try set mapelementcollisionbehavior remainvisible difference
6220,0,like sort internal limit mapicons display time
6221,0,find release note change
6222,0,change behavior expect bug
6223,0,uwp scrollbar white invisible light background
6224,0,dark background
6225,0,skeleton tracking work xbox
6226,0,mediaframesourcekind custom available xbox
6227,0,available pc
6228,0,result skeletal tracking app work xbox platform
6229,0,uwp application platform rich medium api allow query video device e.g.
6230,0,kinect support thing like exposurecontrol
6231,0,auto exposure function cause major headache app work dearly love able turn
6232,0,notice create datapackage contain datum provide directly let text use setdata delay format like bitmap use setdataprovider close application clipboard content clear
6233,0,vs2015 maybe 2017 compiler raise warning miss state code currently unsupported uwp toolchain
6234,0,lead runtime crash long time figure
6235,0,warn sg0002 generate serialization code type
6236,0,methodname property knowntypeattribute type objectmodel entity basething currently support
6237,0,like xaml app automatically reload shut relaunch
6238,0,save developer lot time
6239,0,direction radial progress bar control clockwise
6240,0,xbox provide diagnostic datum app e.g.
6241,0,memory cpu consumption etc
6242,0,section device portal currently datum
6243,0,user ask frequently xbox version app
6244,0,like mobile
6245,0,emulator usually use instead plug device immediately
6246,0,important xbox limited api respect desktop mobile
6247,0,networkinformation object available etc
6248,0,personally enable xbox test app emulator
6249,0,unfortunately xbox sense free app interested spend lot money develop purpose
6250,0,emulator usually use instead of 
6251,0,windows 10 message example nice control enter select contact send email text message etc
6252,0,control include field require contactfieldtype
6253,0,fileopenpicker suggestedstartlocation official description work
6254,0,suggestedstartlocation use start location file picker
6255,0,situation suggestedstartlocation confusing user try pick music file fileopenpicker open pictureslibrary
6256,0,suggestedstartlocation remember continue open folder time
6257,0,mobile phone cpu temperature
6258,0,notice problem soon adapt app use imageex
6259,0,use event change opacity 1 image load sized immediately notice instead display image fade 1-second animation
6260,0,animation hard cod style rid redefine style
6261,0,real pain rid animation
6262,0,problem encounter inability jack info iksjackdescription::getjackdescription
6263,0,new post confirm problem fix follow url
6264,0,thank fix issue
6265,0,notice happen sound issue situation
6266,0,ofcourse use windwos 10 creators update version
6267,0,foreground fulltrustprocess
6268,0,sound normally reboot os
6269,0,large wpf application build virtual earth api heavy customization render pipeline
6270,0,currently multiselectmodel work document
6271,0,player app activate time
6272,0,select file pass app argument parameter
6273,0,far anniversary update creators update concerned multiselectmodel effect file pass argument application regardless file select explorer
6274,0,support passing select file command argument
6275,0,documentation uwp method c require .net platform
6276,0,low level c interface
6277,0,developer bring java python etc application windows store desktop bridge
6278,0,master panel masterdetailsview intend use pulltorefreshlistview usually listview master panel dynamically change use collections emails articles etc
6279,0,save user lot time effort
6280,0,future access list great theory add overhead
6281,0,uwp app compete system thing
6282,0,mention kind app need 1000 file access handicap platform
6283,0,btw futureaccesslist bug people leave platform and 
6284,0,datatemplate behave like xamarin forms datatemplate class 3 constructor
6285,0,datatemplate(func object // provide lot flexibility
6286,0,windows store analytic api great
6287,0,important datum conversions breakdown campaign id table page
6288,0,currently uwp open wasapi output device capture mode com restriction
6289,0,mean loopback auto capture support
6290,0,find api document
6291,0,mediaplayer work onedrive mkv stream previous version creators update
6292,0,player raise sourcenotsupported error
6293,0,markdowntextblock control support fenced code block `` version 1.4 language specific syntax highlighting step e.g.
6294,0,control term separation concern
6295,0,function original text expect return xaml object maybe abstract representation color text handle control
6296,0,function original text expect return xaml object maybe abstract representation color text handle by 
6297,0,talk website
6298,0,problem provide late version
6299,0,important menu toolbar button
6300,0,example thing right simple search popup let focus search similar search cortana work
6301,0,background audio playback work build 14393 work build 15063
6302,0,moment easy way prevent way bind clear dependencyproperty set new value
6303,0,desktop application display dialog use getopenfilename api function access network drive fail
6304,0,problem access computer
6305,0,result error
6306,0,use speech sdk desktop application try use uwp app
6307,0,write helper bind observables similar framework like angular2
6308,0,currently available https://github.com/al3891/observabledatabinding
6309,0,system delete recreate tls self sign certificate device portal port 50443 lot .. 5 10 minute window log
6310,0,sure reset reboot
6311,0,view exception completely useless stacktrace hex value function optimization
6312,0,use
6313,0,enumeration mainly use appbarbutton like appbarbutton icon smile/>.
6314,0,recent segoe mdl2 asset new glyph
6315,0,enumeration symbol update win10 10240
6316,0,important glyph 10240 lack enumeration
6317,0,example share glyph 0xe72d enumerate
6318,0,developer
6319,0,like photo app
6320,0,engineer use bitmap similar glyph
6321,0,happen test update 10.0.14393.953
6322,0,user report problem resign app platform
6323,0,completely understand
6324,0,developer suppose work important thing like access file work os update
6325,0,affect app result platform
6326,0,futureaccesslist issue
6327,0,firmware update phone unable retrieve folder file token
6328,0,token ask present futureaccesslist filenotfoundexception
6329,0,pervious post mark complete https://wpdev.uservoice.com/forums/110705-universal-windows-platform/suggestions/13364760-futureaccesslist-token rise problem
6330,0,let know like use code ready easy use
6331,0,today selectrange(itemindexrange itemindexrange exist listview add new selection range current selection selectedranges property
6332,0,expected behavior
6333,0,release pointer finger list abruptly return position 0 refresh indicator hide
6334,0,notice possibility block payment interface windows store developer account boolean
6335,0,possible pay certain leave remainder block ms account
6336,0,interest ms obvious
6337,0,live connected world
6338,0,connected app benefit fast low latency network work large buffer need
6339,0,textbox indicate validation results filed require ...
6340,0,consistency sak request async awaitable(s
6341,0,ideal world able invoke task optionally send continuation forget
6342,0,right api allow recognition text input
6343,0,know microsoft digital ink recognition technology math formula
6344,0,available wpf math input control
6345,0,15043 loggingchannel logmessage string message portion blank device portal stringmessage
6346,0,code machine anniversary update portal string message payload
6347,0,capture event xperf message eventdata expect know log correctly
6348,0,idea post winrt 5 year ago https://wpdev.uservoice.com/forums/110705-universal-windows-platform/suggestions/2831450-implicit-datatemplates-for-winrt
6349,0,main scenario mvvm resolve view viewmodel
6350,0,scenario describe post https://www.thomasclaudiushuber.com/2017/03/10/building-a-classic-tabbed-and-databound-desktop-app-with-uwp/
6351,0,currently way set backgrounddownloader 's header setheader method unfortunately set heder value clear method
6352,0,method multiple time header
6353,0,value concatenate
6354,0,problem come want create multiple download downloader server require send request header able downloaded file item downloader item require create new downloader instance new header
6355,0,course case use group toast notification
6356,0,request editable combo box allow
6357,0,currently page break support printhelper
6358,0,currently possible specify multiple group subgroup tile size adaptive tile content fit group necessarily drop tile fit group
6359,0,recently browse uwp doc find interesting api accessory management etc
6360,0,perfectly acceptable request access control want create company account
6361,0,api lose customer android ios people love app control volume system theme etc
6362,0,current step outline
6363,0,develop application massively profit api allow volume control etc want use
6364,0,unfortunately use api restrict use access possible company developer account
6365,0,perfectly acceptable request access control want create 
6366,0,lose count number time forget set oneway
6367,0,yes know look code nearly instance set oneway twoway
6368,0,mobile desktop version store app browse category
6369,0,feature present store app xbox
6370,0,app apps section promoted app user download app know search
6371,0,app like publish solely xbox hard user aware app
6372,0,publish app dev center allow select category subcategory app place
6373,0,app like publish solely xbox it 
6374,0,disk space install crash
6375,0,combination toast action center provide convenient lightweight way communication user notification read disappear
6376,0,currently work clock control uwp todo list app 2day www.2day-app.com
6377,0,create control use inspiration great material design wpf toolkit
6378,0,early work progress version available repo https://github.com/japf/uwp-material-clock
6379,0,uwp commandbar easy use build classic toolbar desktop application
6380,0,central control platform
6381,0,ive spend hour build small mvvm uwp pivot prototype typical stuff today wpf tabcontrol
6382,0,impressed far
6383,0,currently pivot overflow panel
6384,0,its wrap header
6385,0,didnt find option
6386,0,create separate uservoice entry
6387,0,styling content able rid entrance animation slide left-animation/-transition
6388,0,allow overflow
6389,0,allow wrapping
6390,0,big ask ask  
6391,0,build treeview control backlog https://developer.microsoft.com/en-us/windows/platform
6392,0,use treeview official sample https://github.com/microsoft/windows-universal-samples/tree/dev/samples/xamltreeview
6393,0,point miss work hierarchical datum hierarchicaldatatemplate like today wpf
6394,0,especially sense release control hierarchical datum like treeview
6395,0,1000 entry limit futureaccesslist way low
6396,0,good practice
6397,0,store folder contain file exceed limit fast store file futureaccesslist
6398,0,exception folder add
6399,0,big downside hide dragdrop https://docs.microsoft.com/en-us/windows/uwp/app-to-app/drag-and-drop
6400,0,counter try add folder file possible exception throw add file futureaccesslist
6401,0,example try add folder dragdrop filetarget futureaccesslist
6402,0,// able add folder
6403,0,long notice day change de windows app store seacchresult
6404,0,pc app hard find way
6405,0,notice mobile store app twice search keyword
6406,0,new policy bug
6407,0,build line business app enterprise focus desktop
6408,0,today use wpf task
6409,0,similar request report control rdlc support
6410,0,currently nearly impossible create custom virtualizing panel
6411,0,uwp impossible base class private constructor class seal
6412,0,lot custom control use virtualization hard implement uwp
6413,0,control hard impossible use large collection
6414,0,adcontrol xbox retail mode crash app work fine dev mode desktop mobile
6415,0,change microsoft store services sdk framework microsoft advertising sdk xaml library update automatically xbox february 9th 2017
6416,0,repro download app store contain ad instantly crash spash screen
6417,0,platform support .net silverlight android xamarin ios xamarin
6418,0,uwp team stubbornly resist
6419,0,platform allow customization download dynamically load app domain
6420,0,app increasingly encrypted route app eartrumpet find harder harder retrieve run appx app 's current application icon i.e.
6421,0,api messy appropriate loading scale sensitive asset
6422,0,parse pri possible unencrypted appx scenario
6423,0,current option current drawback
6424,0,genuine use case need app run close button press
6425,0,allow app catch close button event minimise task bar programatically
6426,0,currently save mp3 stream file read file transmit tcp
6427,0,scenario shoutcast source internet radio streaming
6428,0,shoutcast source transmit mp3 datum tcp shoutcast server
6429,0,currently process appservice invoke actually launch main app ui
6430,0,user launch main app ui close appservice terminate share process
6431,0,control confuse exist pivot viewer uwp
6432,0,control great addition display large datum visual friendly format
6433,0,control equivalent pivot table excel simply add dataset label control sort selection field visualization animation
6434,0,original microsoft link pivot control silverlight
6435,0,relate feature request
6436,0,necessary ensure download base image corrupt nice provide
6437,0,port windows phone silverlight app uwp depend panorama control miss uwp
6438,0,hub control suitable replacement
6439,0,use case groove spotify lyric functionality anymore create simple uwp app manage lyric song
6440,0,follow datum great
6441,0,link github https://github.com/microsoft/uwpcommunitytoolkit/issues/821
6442,0,systemtriggertype powerstatechange trigger percent change
6443,0,option useful
6444,0,right lock screen text icon notification
6445,0,way implement complex text markup render direct2d slow manual composition inside canvas control
6446,0,absolutely easy way implement selectable text complex markup
6447,0,richeditbox control exist lightweight control display rich text richtextblock relate richeditbox feature lame
6448,0,toastnotification object convenient expirationtime property automatically dismiss period
6449,0,unfortunately scheduledtoastnotification toastnotofcation schedule lack help feature
6450,0,developer scracth head write lot code include background task circumvent problem user app crowd relevant anymore notification action center
6451,0,mapcontrol limited operation custom tile
6452,0,ne redraw tile periodically outdated closest similar example traffic layer need periodically refresh
6453,0,operation result tile flickering redraw use 3 tile source switch
6454,0,crasy staff involve heavy redrawing map lead visble scroll slow moment maptilesource add nice fix
6455,0,ugly workaround use add remove maptilesource force tile redraw
6456,0,currently uwp app ability include menu control excellent mouse support
6457,0,click close menu second click open new
6458,0,moment possibility quickly navigate long list small screen
6459,0,list alphabetic order thousand entry start letter
6460,0,dont know component look like
6461,0,list alphabetic possibility jump entry letter
6462,0,want test app multiple language change region entire device
6463,0,develop windows universal app sicked tired find way implement encrypt local db support
6464,0,database file encrypt sql cipher read record
6465,0,sqlcipher support commercial edition 899 afford expense
6466,0,surprisingly support universal app implementation
6467,0,ridiculous sick tired find way
6468,0,microsoft support local database develop universal app
6469,0,understand confused situation possible android ios easy
6470,0,know sqlite support universal app development nuget vs2015
6471,0,ridiculous sick tired 
6472,0,basic scenario need store set secret api key 3-rd party api twitter example
6473,0,hardcode api key inside app executable file security risk reverse engeneer
6474,0,hello currently bug insider preview desktop phone
