2110,0,power hungry task high priority run soon external power available wait hour battery charge 90
2111,0,task need run frequently short period
2112,0,example log gps position tracking application vehicle power supply phone run 2sec 30sec background task run 30min 30sec send batched datum webservice
2113,0,example log gps
2114,0,ssdp use upnp rely udp multicast discovery
2115,0,currently udpanysourcemulticastclient allow listening exist ssdp traffic send solicitation search request upnp device advertise solicitor
2116,0,device reply search message send unicast message ip port search message send
2117,0,way wp7 application use udpanysourcemulticastclient socket listen correct port require great deal time spend upnp application device discovery
2118,1,proper socket support fix udpanysourcemulticastclient implementation explicit ssdp client support send handle reply search message enable
2119,0,proper socket
2120,1,provide api provide access text allow developer implement application enable scenario read archive sms message
2121,0,
2122,1,api enhancement access contact information subset
2123,0,especially like photo
2124,0,silverlight xna___________________________________________________________________________________________________xna________________________2.0________________________textreadtoend
2125,0,mime email mandatory requirement company support windows phone platform need consider
2126,0,ime
2127,0,local database support useful addition text search support quickly query large text e.g.
2128,0,dictionary
2129,0,implementation sql ce support text index i.e.
2130,0,freetext rival platform android ios exploit sqlite 's text support wp7 currently disadvantage
2131,0,wav______)________________________________________________________________________________api
2132,1,easy access bing music api useful especially app artist song recognition
2133,1,microsoft allow developer use bing maps api api realy hope consider open bing api come tango apollo dev toolset
2134,1,nice callback example phonecalltask determine wether user actually press cancel
2135,0,task launcher
2136,1,nice able download entire windows phone tools install instead use web installation
2137,0,teacher install way entire lab forever
2138,0,event trigger end phone nr length opportunity display app screen
2139,0,great business scenario
2140,0,bingmapsdirectionstask
2141,0,simple sound gift app windows device
2142,1,button allow purchase send app game
2143,0,encrypted dabase file generate wpdt open vs2010 sql server 2008.hope fix
2144,0,funny zune ability sort pictures sync windows 7 phone lose ability
2145,1,want feature useful way
2146,0,like dialer application list number web notate happen keyboard button automatically launch
2147,0,workflow suck right confirm dial number
2148,1,new setting allow user optin functionality
2149,0,watch video audio bluetooth headphone listen audio
2150,0,microsoft introduce native c++ sdk wp7 create pc emulator c wp7
2151,0,like qemu windows mobile
2152,1,manage sdk add support use ssl client certificate ssl mutual authentication httpwebrequ and/or web service proxy class
2153,0,security important deal access sensitive datum
2154,0,hear people hardly mobile landline international number possible hear people
2155,0,30 bar mango 10 volume bar ..
2156,1,suggest 30
2157,0,yes try different headphone different phone test operator connection quality
2158,0,android iphone fine volume android loud
2159,0,use omnia 7 untill volume update :( media volume omnia 7 fine loud prefer good hear people hardly mobile landline international number possible hear people
2160,0,use omnia 7 untill volume update :( media volume omnia 7 fine loud
2161,0,windows phone sdk___expression blend________________________________________________________________________(vs expression blend____________xaml___________________________________________________us sdk________________________us
2162,0,
2163,1,provide viewer view office document e.g.
2164,0,word excel powerpoint basically
2165,0,uiwebview iphone support serveral format good user experience content relate app
2166,0,wp7 view pdf office webbrowsertask
2167,0,mango possible anymore time generate url
2168,0,request twice
2169,1,fix ... app function usable anymore :-( http://forums.create.msdn.com/forums/p/88705/548248.aspx
2170,1,idea simple open marketplace developer devs submit application develop extended api allow access information capability device
2171,0,instance text contact read write socket listen real multitasking etc ... know release super restrict api avoid develop app inexpert user trouble
2172,0,developer afford lot benefit kind app
2173,0,listbox listbox p.s.
2174,0,people hub
2175,0,"sdk 7.1 possible record audio use audiosink silverligh class need trick system use xna loop use class tag capability name=""id_cap_camera""/ present wmappmanifest.xml file use microphone"
2176,0,webbrowser___________________________________writeablebitmap_________________________________________________________web http://social.msdn.microsoft.com/forums/en-us/windowsphone7series/thread/13665684-6618-43ed-a370-018929d19df7
2177,0,1)textbox____________________________________9_____________________bs enter 2)passwordbox inputscope
2178,0,mobile pbx need transfer phone pbx
2179,0,nowadays feature forwarding divert hace pick incoming
2180,0,explorer shield picture
2181,0,emailcomposetask html support
2182,0,plain text professional app today
2183,0,pcm audio encoding available need way encode compress audio wma mp3 encoding allow small transfer send audio web service
2184,0,moment periodic task run 30 minute
2185,1,suggestion interval configurable
2186,0,example want retrieve gelolocation frequently background
2187,0,possible moment
2188,0,platform ios android support
2189,1,let user decide want concern battery life etc
2190,1,define restriction developer
2191,0,texture coordinate transform expose effect use reach profile gpu probably cheaply
2192,0,developer able grant access app datum access
2193,0,app contact app query contact datum instead provide 's mechanism contact
2194,0,pivot selectedindex twoway)_______________0 pivot selectedindex http://www.moto-square.com/2011/06/17/windowsphone7-development-07/
2195,0,like caller phone number etc
2196,0,start sole developer group register business irs
2197,1,like able convert individual account marketplace company lose publisher brand app portfolio user base
2198,0,common scenario real world impossible marketplace
2199,0,enter number additional simbol
2200,1,great -- tab jump textbox
2201,0,business apps usually kind need
2202,0,great idea app ... good chunk cod find smscomposetask ability attach image mms
2203,0,come future release
2204,0,ideally emailcomposetask ....
2205,0,focus_________mango_________bug
2206,1,card view great able close run application swipe away use cross close whatev mean enter application press button time consume annoying
2207,1,like metadata project vs
2208,0,allow suggest streamlined process track change upload single package fill blank
2209,1,editor like property setting great
2210,1,sharelinktask sharestatustask report error information user social network
2211,1,launcher callback return string error message
2212,0,launcher possible property useful disable enable button start launcher
2213,1,like improvement mappolyline allow multiple individual segments property i.e.
2214,1,example add location mappolyline instance segment able control look feed color stroke segment mappolyline
2215,0,currently change stroke change color entire line regardless location add line
2216,1,like ability line 3d gradient shape pop map control
2217,1,wish select connection speed debug emulator
2218,0,android emulator
2219,0,area mango retrograde step compare nodo theme support
2220,0,nodo user leave app switch theme i.e.
2221,0,dark light return app theory respect selection
2222,0,mango user 's face unholy mess app inform system 's theme state start
2223,0,developer choice look incompetent ruthlessly pick theme stick render ability choose overall theme pointless
2224,0,smscomposetask provide event
2225,1,think need complete event like smsresult use
2226,0,currently task exhibit behaviour
2227,1,standard mode usage task
2228,0,spam application app split region i.e.
2229,0,mytranspo series ridiculous feed reader different musician whatnot single book application app i.e.
2230,0,stuff publish eric_rulz ...
2231,0,absolutely ridiculous
2232,0,promise care work
2233,0,useless application flood marketplace sign slow
2234,1,believe instead limit certification user day marketplace little good curat
2235,1,spam application approve
2236,1,pass certification publish
2237,1,bulk publisher consolidate app rest pass
2238,0,
2239,0,think raise platform request feature feedback instead
2240,0,multiline text input current version platform usable work tell intuitive concerned app substantial feature experience consumer
2241,0,current capability multiline navigation textbox -------------------------------------------------------------------- way currently work tap hold cursor appear
2242,0,enter long line text width textbox likely instinctively find scroll text drag cursor textbox
2243,0,enter short line find drag action work time cursor contact text
2244,0,visually lock text happen
2245,0,believe confuse user create unecessary friction consumer use app depend multiline input potentially long display half allow sip portrait landscape screen
2246,0,improve usability
2247,0,swipe gesture control vertical scrolling vertical scrollbar auto visible currently ignore
2248,1,use tap hold allow vertical scrolling lock text describe
2249,0,alternatively ---------------- provide experience consistent platform sms text input capability provide support allow textbox 1 grow new line add
2250,0,2 place scrollviewer viewport follow newline add
2251,0,thank consider
2252,0,link related app hub suggestion http://forums.create.msdn.com/forums/p/74377/453077.aspx#453077 link relate connect issue https://connect.microsoft.com/visualstudio/feedback/details/641068/multiline-text-input-on-windows-phone think raise platform request feature feedback instead
2253,0,enter
2254,1,play video html5 video tag player allow user drag progress bar seek ahead video
2255,1,like write business applications start phone turn control run app .. idea phone snap picture periodically upload ..
2256,0,currently way know emailcomposetask cancel error send
2257,1,need able tell user actually email know delete email text
2258,0,ask user send poor user experience
2259,1,want provide free application nice wp7 support self sign cert widely know free ssl authority
2260,1,add servicepointmanag
2261,1,add free service accept list ssl authority
2262,0,like cacert.org instance
2263,1,like agent like scheduled task execute specific date time
2264,0,able recur save battery limit daily
2265,0,think app need update tile year month remind user
2266,0,currently possible agent disable 15 day application open
2267,0,app specific launcher instead open site 's web page check compatible app instal register
2268,0,ux good
2269,0,support thing like midroll video advertisment multiple mediaelement need
2270,0,support silverlight web
2271,0,helpfull passwordbox like control support number keyboard
2272,0,numeric password sense smartphone world fast convenient easy type
2273,0,private corporate wifi authentication certificate support mango
2274,0,allow scenario currently lock carrier wp7 phone available
2275,0,actually purchase app marketplace use
2276,0,enable code run windows phone
2277,1,good video chooser task work way photochoosertask
2278,0,reason user able thing like apply filter add audio track crop relevant section etc ... recorded video save medialibrary
2279,0,assume save medialibrary ar functionality mango
2280,0,benefit application create audio recording voice easy unify way export audio file instead create extra server program
2281,1,cursor arrow key need virtual keyboard
2282,0,use touch position cursor good start clumsy easily character acceptable left arrow key addition backspace
2283,0,press+hold backspace bring arrow menu
2284,0,interest add capability
2285,0,request multiscaleimage library able access isolated storage
2286,0,place app connect cell tower e.g.
2287,0,general aviation commercial aircraft cell phone work illegal use case isolate rural area
2288,0,pay datum charge view image aren___t music photo library store phone
2289,0,finally memory cheap
2290,0,suggest large image break tile inappropriate storage phone ridiculous
2291,0,user want application host content 1 gb music 1 gb image tile need application prerogative
2292,1,local multiscaleimage functionality available iphone wp7 developer disadvantage
2293,0,user want pan large image difference form factor local online
2294,1,component open isolated storage use near future
2295,0,suggest large image break tile inappropriate storage phone
2296,0,implementation sql compact pretty steap learn curve use .net gui implementation easy use
2297,1,think need focus easier quicker implement plumbing feature lot developer hobbyist contain time knowledge require implement lot plumbing feature
2298,1,quick simple idea
2299,1,detailed customization thought
2300,1,allow app interop capabilty flag manifest custom certificate like microsoft office digital certificate vba projects
2301,0,valid device create phone brick dev unlocked
2302,1,ok realize dependent carrier wp7 need support carrier offer
2303,0,somebody correct way base
2304,0,let know
2305,0,ios droid use work email exchange server
2306,0,webbas certificate sign trust member allow okay oses
2307,0,wp7 let use exchange register instal certificate let bypass know okay
2308,0,ability display street bird eye view bing map control
2309,0,update app update app tile icon and/or background image save update work
2310,1,allow application launch application url
2311,1,launch application allow send information launch application query string
2312,0,imagine involve wait notification display available long time mobile relief contact later instead recurring calling bother
2313,0,missing feature window mobile
2314,0,agree time
2315,1,add tile view like old windows 8.1 store
2316,0,great glance rating money generate application ...
2317,1,enable recording fm radio
2318,0,currently mango soft search button gui display context sensitive search
2319,0,hardware button pull bing
2320,0,surely design ideology hardware search button context sensitive
2321,1,soft search button need remove display hardware button available
2322,0,free screen real estate especially application bar soft search button
2323,0,order display detail network connection distinguish wifi network connect
2324,1,allow filtering marketplace result category pay free new add filter rating ex 4 price ex 1.99 number download ex 10000 allow blacklisting developer developer ranking spam app spam devs avoid
2325,1,enable fm scan function developer api
2326,0,notice available user 7.1 version mango method api scanning signal seek whatev term
2327,1,allow app hide visible store update process
2328,0,old dashboard ideal simple link toggle visible hide
2329,0,handy end server offline new user download app instantly think app useless
2330,0,new store possible delete exist app store(or exist hidden
2331,0,addiction try delete app confirm operation delete stay reserved app ..
2332,0,total download app anymore download prior new dashboard vanish
2333,0,currently need trickery screenshot application use panorama control
2334,0,access exif info limit use picture object deal media library
2335,0,try save image app inside media library isolated storage prserve exif info image
2336,1,good manipulation exif api helpfull
2337,0,read link detail http://forums.create.msdn.com/forums/p/84673/510718.aspx#510718
2338,0,use defaultitem property panorama control rearrange item
2339,0,use property restore application state tombston user experience terrible cause pano item reorder
2340,0,correct behavior panorama immediately scroll default page animate
2341,0,old developer dashboard allow remove app longer want publish
2342,0,new developer center app pass certification publish store
2343,0,keyword people use unsuccessful marketplace search particularly desktop zune application rank frequency provide useful information developer focus development effort
2344,0,create opportunity developer help provide customer app want
2345,0,need create pro level sequencer synth music creation relate app
2346,0,want update live tile app draw background image phone store isolatedstorage able uri provide standardtiledata object
2347,0,extras menu option ie 3rd party app plug possible pass url currently select site app add value instance option subscribe rss atom feed present
2348,0,develop phone connect usb screen lock annoying app deployment fail
2349,0,wp7 phone at&t samsung focus screen timeout
2350,0,battery powered scenario want manually switch forth time
2351,0,stick phone lock time
2352,0,screen lock interrupt prevent app deployment
2353,0,visual studio fail start debugging session
2354,1,app deployment unlock screen reset lock timer zero
2355,0,app deployment unlock screen reset
2356,1,need beta store window 10 app select internal tester
2357,0,window phone store possible beta version app window app
2358,1,copy android add beta alpha store
2359,0,complain developer prefer platform life easy
2360,0,currently assign applicationbariconbutton icon present project content
2361,0,basically mean determine icon design time
2362,0,provide ability assign icon place isolatedstorage developer free create button icon runtime dynamically download place etc
2363,0,option delete beta app dashboard
2364,1,option delete mpns certificate
2365,0,believe ado.net
2366,0,sql query run
2367,0,redo application windows mobile monotouch monodroid wpf wp7
2368,0,core code run platform wp7.1 rewrite
2369,0,unacceptable
2370,0,application migration new dashboard use original product id bind high german map failure
2371,0,add new test user new submission
2372,1,posibility add new test user real time mode
2373,0,quickly easy
2374,1,ability create game access xbox live achievement
2375,0,access
2376,0,partner xbox live mark game icon place achievement leader board friend great wp7 live
2377,0,people developer submit app marketplace behalf reason
2378,0,country support example
2379,0,developer work app splitting
2380,0,people sell app
2381,0,case break update cycle exist user new owner create new app instead update exist
2382,0,create pay app trial option user blow right free category light version app free trial
2383,0,people resort super inefficient apple app store method release 2 version app ... free category run pay app
2384,0,trial fantastic concept hobble oversight
2385,1,add ado.net silverlight .net framework use dataset work xml relational data c windows phone 7
2386,0,right way sync picture generate phone user 's pc
2387,0,create word processor style application sort start integrate service service cloud user 's device
2388,0,user sensitive datum usage cost money
2389,0,customer understand connect phone thi pc file automatically sync' folder dedicate
2390,0,especially wierd sync picture music
2391,0,especially wierd sync picture
2392,1,need write bitmap painful imagine vnc client example window phone right support copy- writepixels method
2393,1,like overview review app
2394,0,moment open review app time
2395,0,app like 40 lot time
2396,1,maybe add apps option page filter review
2397,0,dear team support upload game window phone store friday kind bug window phone store
2398,0,create new app reserve fightoftheleneg try create app package package list visual studio
2399,0,unable understand reason
2400,0,help upload new game store
2401,0,use visuall studio 2013
2402,0,update app listing support multiple language painful experience develop windows
2403,1,store manifest include localize description screenshot etc
2404,0,detect upload app dashboard
2405,0,allow skip crazy input 32 different language example swap screenshot
2406,1,alternatively provide api submission process somewhat alleviate pain
2407,0,great way better integrate application sport news hub
2408,1,imagine default setup simply default news sport msn ms affiliate allow rss feed add
2409,1,enhance allow 3rd party application tie like espn 's app news bbc cnn application
2410,1,ms add feature like media center sports ticker feed fantasy player tracking
2411,0,support windows server 2008 r2
2412,1,control display sip focus provide method close sip ensure datum binding apply
2413,0,currently user click save button right use sip datum enter persist object bind control
2414,0,possible like microsoft windowsmobile.status development windows phone 7.1
2415,0,purpose event relate phone start end
2416,0,sms
2417,0,perform action background
2418,1,allow developer use build api compress video capture camera use h264 mpeg-4
2419,0,usefull explore tranfer file generate app run phone emulator developer pc additional coding
2420,1,remove 10 recipient cap app generate sms message
2421,0,obviously place ensure people spend lot money unlimited bundle
2422,0,simple message box message send 36 people sure want send sufficient
2423,0,system featuresuggestion good miss feedback feedback
2424,0,moment idea mark plan
2425,0,idea ship update mark planed startet
2426,0,people use platform positive feedback vote manualy search vote longer need provide update
2427,0,company work loose project client 's requirement change windows wallpaper ringtone feature disponible windows phone 7
2428,0,project develop andriod
2429,1,allow maintain app package store asset description screenshot metadata git repository simply push git remote upload
2430,0,currently tedious hour submit app update especially multiple app package lot language
2431,0,manually use website change description switch language lot copy paste remove screenshot new screenshot
2432,0,literally hour drive crazy
2433,0,instead ready locally push upload quickly
2434,0,currently app execute sandbox way app work
2435,0,app look information internet open app scan barcode ..
2436,0,true application os
2437,1,kind handler context menu certain object great
2438,0,context menu image list task provide app deal image
2439,0,detailed extremely simplified app rotate image app upload image web app capable send image near printer
2440,0,detailed extremely simplified app rotate image app upload image web app capable send
2441,0,want use uac security risk
2442,0,want metro app
2443,0,application developer currently pre mango facility access c content incoming sms message
2444,1,great application register capability enable scenario sms challenge authentication
2445,1,add ability set referrer custom header use httpwebrequest
2446,0,company like wp7 nonexistence visual voice mail stop switch iphone
2447,0,way access voice mail metadata
2448,1,distribute application bar icon sdk use build application provide forum marketplace artwork include control template style
2449,1,increase webbrowser control function
2450,0,google playbook apple ibook good reading ebooks party application easy reading ebook theme inbuilt dictionary lack feature term user experience
2451,1,nice window phone microsoft device onebook application read ebooks magazine etc ..
2452,0,understand max size limitation control
2453,0,approach work control
2454,0,control e.g.
2455,0,textbox big problem
2456,0,socket api duplex wcf communication
2457,0,currently possoble connection proxy server require authentication
2458,0,limit business type app use resource run app connect work network
2459,0,currently possible web browser
2460,1,support chinese
2461,1,allow developer alter edit application metadata include description image graphic pricing keyword etc ... app publish resubmitt
2462,0,bug fix spelling screeshot simple save microsoft test submission metadata
2463,0,maybe send zip
2464,0,system support application error reporting service report developer application crash detail
2465,1,wish simulate multitouch emulator ie pinch zoom 2 mouse
2466,1,like picture extra ... great app like twitter facebook register list application user share piece text addition email sm
2467,0,enable number cross app communication scenario let user choose want share info
2468,0,enable caching usage offline map
2469,0,windows phone 8.1 painful lot time work
2470,0,hope automate tool localised screenshot
2471,0,navigate page press button n screenshot language
2472,0,upload website way remove screenshot way upload asset language
2473,1,provide pre certification tool run test marketplace certification tool run
2474,0,developper confidence pass test fix issue submit marketplace
2475,0,time saver developers microsoft
2476,0,phone currently play large selection medium format mp4 m4v 3gp etc support emulator
2477,0,app use format extremely hard debug
2478,0,awesome fix :)
2479,0,like picture music extra able integrate person phone numbers(unkown caller add phone service easy search number able start contact message app contact card
2480,1,allow application register messaging endpoint device e.g.
2481,0,register launcher chooser ease device inter application communication
2482,0,palm pre 's multitask switch know ms good
2483,0,hopefully fluently switch creative gesture ui
2484,0,use pivot panorama handle sensitive degree feel high want edit way
2485,0,currently store app submit store
2486,1,allow submit exist windows desktop software store
